{"authoritative_scoring":false,"controls":{"active_duration_ns":30000000000,"disable_log_stats":true,"gpu_memory_utilization_per_instance_ppm":360000,"max_model_len":2048,"max_num_seqs":8,"producer_interval_ns":5000000,"queue_capacity":8,"sampling_max_tokens":12,"sampling_seed":0,"temperature_millionths":0,"trust_remote_code":false},"date":"2026-08-21","failure_codes":["SYNTHETIC_FIXTURE_ONLY"],"model_identity":{"quantization":"OFFICIAL_QWEN_FP8_E4M3","repository_id":"Qwen/Qwen3-4B-Instruct-2507-FP8","revision":"8591804019c8b22094c3b5b4454e0edc05dffc98"},"protected_seed_access":false,"regime":"B","run":{"active_duration_ns":0,"all_executions_overlap":false,"all_outputs_agree":false,"cleanup_gpu_used_mib":-1,"dropped_windows":0,"initialization_a_ns":0,"initialization_b_ns":0,"max_launch_skew_ns":0,"order_preserved":true,"peak_gpu_used_mib":0,"producer_backpressure_observed":false,"producer_blocked_count":0,"windows_consumed":0,"windows_produced":0},"runtime":{"VLLM_USE_FLASHINFER_SAMPLER":"0","VLLM_USE_V2_MODEL_RUNNER":"0","runner":"V1"},"schema_version":"m4-wsl2-dual-model-probe-report-v1","scientific_evidence":false,"status":"BLOCKED","synthetic_only":true,"windows":[]}
